<?xml version="1.0" encoding="UTF-8" ?>
<!DOCTYPE Persons SYSTEM "Persons.dtd" >
<Persons>

    <Person>
        <Email>asd@mail.ru</Email>
        <Nickname>asd</Nickname>
        <Password>1234</Password>
        <Ads>
            <Ad >
                <Rooms>2</Rooms>
                <Description>Квартира в центре города</Description>
                <Adress>Пр.Пушкина 2-3-4</Adress>
                <Floor>2</Floor>
                <Floors>5</Floors>
                <Square>21</Square>
                <Price>300k</Price>
            </Ad>
            <Ad ><Rooms>3</Rooms>
                <Description>Квартира в спальном районе</Description>
                <Adress>Центральная, 212</Adress>
                <Floor>4</Floor>
                <Floors>10</Floors>
                <Square>43</Square>
                <Price>250k</Price>
            </Ad>
            <Ad ><Rooms>1</Rooms>
                <Description>Квартира рядом с метро</Description>
                <Adress>Победителей,24</Adress>
                <Floor>1</Floor>
                <Floors>10</Floors>
                <Square>25</Square>
                <Price>221k</Price>
            </Ad>
        </Ads>
    </Person>

</Persons>